{"schema_version":1,"sequence_id":"sdk-v3-privacy-safe-sequence","version":1,"prepared_at":"2026-10-19T12:00:00.000000Z","updated_at":"2026-10-19T12:00:00.000000Z","idempotency_key":"bbbbbbbbbbbbbbbbbbbbbbbbbbbbbbbbbbbbbbbbbbbbbbbbbbbbbbbbbbbbbbbb","definition":{"schema_version":3,"sequence_id":"sdk-v3-privacy-safe-sequence","name":"Privacy-safe SDK v3 fixture","project_name":"fixture-project","repository":{"root":"/fixture/repository","worktree_key":"3e474fd57be38c63cde1759369cc9a9321f8eca3ee9cbb5f9d0e03c1549dbebf"},"manifest_original_artifact_path":"sequence/manifest.original.yaml","manifest_original_sha256":"aaaaaaaaaaaaaaaaaaaaaaaaaaaaaaaaaaaaaaaaaaaaaaaaaaaaaaaaaaaaaaaa","manifest_resolved_artifact_path":"sequence/manifest.resolved.yaml","manifest_resolved_sha256":"aaaaaaaaaaaaaaaaaaaaaaaaaaaaaaaaaaaaaaaaaaaaaaaaaaaaaaaaaaaaaaaa","controller":{"controller_session_id":"11111111-1111-1111-1111-111111111111"},"entries":[{"schema_version":3,"ordinal":1,"phase_name":"fixture-phase-1","planned_run_id":"sdk-v8-privacy-safe-fixture-1","commit_message":"accepted fixture checkpoint","plan_prompt":{"plan_repository_path":"docs/plans/sample-plan.md","prompt_source_repository_path":"docs/plans/prompt.txt","plan_artifact_path":"plan/plan.md","plan_sha256":"aaaaaaaaaaaaaaaaaaaaaaaaaaaaaaaaaaaaaaaaaaaaaaaaaaaaaaaaaaaaaaaa","prompt_artifact_path":"prompts/cursor-initial.txt","prompt_sha256":"aaaaaaaaaaaaaaaaaaaaaaaaaaaaaaaaaaaaaaaaaaaaaaaaaaaaaaaaaaaaaaaa"},"effective_config":{"effective_config_artifact_path":"effective-config.yaml","effective_config_sha256":"aaaaaaaaaaaaaaaaaaaaaaaaaaaaaaaaaaaaaaaaaaaaaaaaaaaaaaaaaaaaaaaa","source_config_artifact_path":"source-config.yaml","source_config_sha256":"aaaaaaaaaaaaaaaaaaaaaaaaaaaaaaaaaaaaaaaaaaaaaaaaaaaaaaaaaaaaaaaa"},"codex":{"review_model":"gpt-5.6-sol","review_reasoning_effort":"high","review_model_source":"explicit","review_reasoning_source":"explicit","command":"codex","review_skill":"review-staged-cursor-execution","sandbox":"workspace-write","binding_artifact_path":"codex/fresh-reviewer-input.json","binding_sha256":"aaaaaaaaaaaaaaaaaaaaaaaaaaaaaaaaaaaaaaaaaaaaaaaaaaaaaaaaaaaaaaaa"},"cursor":{"schema_version":1,"runtime":"sdk-local","sdk_version":"1.0.37","model":"fixture-sdk-model","parameters":{"context":"256k","fast":false,"reasoning_effort":"high"},"credential_ref":"fixture-credential-reference","setting_sources":["project"],"sandbox":"disabled","tool_policy":"scheduler-owned-no-shell"},"workflow":{"max_review_iterations":3,"stage_mode":"all","cursor_timeout_minutes":30,"codex_timeout_minutes":30,"require_clean_worktree":true},"implementer":{"schema_version":2,"provider":"cursor","purpose":"implementer","runtime":"sdk-local","model":"fixture-sdk-model","reasoning_effort":null,"timeout_minutes":90,"sandbox":"disabled","approval_policy":null,"session_id":null}},{"schema_version":3,"ordinal":2,"phase_name":"fixture-phase-2","planned_run_id":"sdk-v8-privacy-safe-fixture-2","commit_message":null,"plan_prompt":{"plan_repository_path":"docs/plans/sample-plan.md","prompt_source_repository_path":"docs/plans/prompt.txt","plan_artifact_path":"plan/plan.md","plan_sha256":"aaaaaaaaaaaaaaaaaaaaaaaaaaaaaaaaaaaaaaaaaaaaaaaaaaaaaaaaaaaaaaaa","prompt_artifact_path":"prompts/cursor-initial.txt","prompt_sha256":"aaaaaaaaaaaaaaaaaaaaaaaaaaaaaaaaaaaaaaaaaaaaaaaaaaaaaaaaaaaaaaaa"},"effective_config":{"effective_config_artifact_path":"effective-config.yaml","effective_config_sha256":"aaaaaaaaaaaaaaaaaaaaaaaaaaaaaaaaaaaaaaaaaaaaaaaaaaaaaaaaaaaaaaaa","source_config_artifact_path":"source-config.yaml","source_config_sha256":"aaaaaaaaaaaaaaaaaaaaaaaaaaaaaaaaaaaaaaaaaaaaaaaaaaaaaaaaaaaaaaaa"},"codex":{"review_model":"gpt-5.6-sol","review_reasoning_effort":"high","review_model_source":"explicit","review_reasoning_source":"explicit","command":"codex","review_skill":"review-staged-cursor-execution","sandbox":"workspace-write","binding_artifact_path":"codex/fresh-reviewer-input.json","binding_sha256":"aaaaaaaaaaaaaaaaaaaaaaaaaaaaaaaaaaaaaaaaaaaaaaaaaaaaaaaaaaaaaaaa"},"cursor":{"schema_version":1,"runtime":"sdk-local","sdk_version":"1.0.37","model":"fixture-sdk-model","parameters":{"context":"256k","fast":false,"reasoning_effort":"high"},"credential_ref":"fixture-credential-reference","setting_sources":["project"],"sandbox":"disabled","tool_policy":"scheduler-owned-no-shell"},"workflow":{"max_review_iterations":3,"stage_mode":"all","cursor_timeout_minutes":30,"codex_timeout_minutes":30,"require_clean_worktree":true},"implementer":{"schema_version":2,"provider":"cursor","purpose":"implementer","runtime":"sdk-local","model":"fixture-sdk-model","reasoning_effort":null,"timeout_minutes":90,"sandbox":"disabled","approval_policy":null,"session_id":null}}]}}
